{
  "schema": "mantle-radiance-reference-receipt-v1",
  "source_cohort": {
    "schema": "mantle-radiance-source-cohort-v1",
    "members": [
      {
        "role": "radiance",
        "repository_url": "https://code.radiant.computer/radiance",
        "observation": {
          "schema": "mantle-source-observation-v1",
          "source_kind": "vcs-snapshot",
          "locator_class": "git-remote",
          "locator_hint": "https://code.radiant.computer/radiance",
          "immutable_revision": {
            "object_format": "sha256",
            "value": "0d8a2d4fe8d0ba488e22c8ed83df1e53a5d23d69489c5d9e7fa0646b1c29c444"
          },
          "normalized_projection": ".",
          "snapshot_profile": "canonical-tree-v1",
          "content_blake3": "135c2f75eea21199b4538f5f0096e3e329c6b8b70943017644f9cdef05573c66",
          "observation_blake3": "c3503ed3a34a8ea85f732205112578c76b82e7a719cedc67ed09d0f392d7069f",
          "provenance": "complete",
          "non_claim": "source-observation-binds-supplied-origin-projection-profile-and-content-facts-without-proving-ownership-trust-review-or-correctness"
        },
        "license_spdx": "MIT",
        "license_blake3": "d0f870e9de0345cb08c6ecc3367d99c12a89756d23cfec7f8260aaf1dcc888b6"
      },
      {
        "role": "bootstrap-compiler",
        "repository_url": "https://code.radiant.computer/radiance.s0",
        "observation": {
          "schema": "mantle-source-observation-v1",
          "source_kind": "vcs-snapshot",
          "locator_class": "git-remote",
          "locator_hint": "https://code.radiant.computer/radiance.s0",
          "immutable_revision": {
            "object_format": "sha256",
            "value": "7834d3a9d44fb48ae3d3c06da992922f3e46b580b3d92df36372081b2fe475c3"
          },
          "normalized_projection": ".",
          "snapshot_profile": "canonical-tree-v1",
          "content_blake3": "8c49dadd15e6834dd3204a35f4be00cf1cc01c9672c235a78a0c909b97aa8f1b",
          "observation_blake3": "5a3ce8a6f18d3fbc506ce7b39591a707aef3ac8abb45ec3a51474abee375ddcf",
          "provenance": "complete",
          "non_claim": "source-observation-binds-supplied-origin-projection-profile-and-content-facts-without-proving-ownership-trust-review-or-correctness"
        },
        "license_spdx": "MIT",
        "license_blake3": "d0f870e9de0345cb08c6ecc3367d99c12a89756d23cfec7f8260aaf1dcc888b6"
      },
      {
        "role": "emulator",
        "repository_url": "https://code.radiant.computer/emulator",
        "observation": {
          "schema": "mantle-source-observation-v1",
          "source_kind": "vcs-snapshot",
          "locator_class": "git-remote",
          "locator_hint": "https://code.radiant.computer/emulator",
          "immutable_revision": {
            "object_format": "sha256",
            "value": "92cdb0c5293447964be053214fac403b49193ac3ec07c902576346ebaa205535"
          },
          "normalized_projection": ".",
          "snapshot_profile": "canonical-tree-v1",
          "content_blake3": "a6e91a2a6edc0aa4d5ca3c870012fdfb4f14748fed2829c46f6466efab3a27ec",
          "observation_blake3": "1834bfecc3f53e448b8c0bbe8e3635e6414438c360d70460458dabc8aeb90fa4",
          "provenance": "complete",
          "non_claim": "source-observation-binds-supplied-origin-projection-profile-and-content-facts-without-proving-ownership-trust-review-or-correctness"
        },
        "license_spdx": "MIT",
        "license_blake3": "d0f870e9de0345cb08c6ecc3367d99c12a89756d23cfec7f8260aaf1dcc888b6"
      }
    ],
    "cohort_blake3": "80c82a016b6232aa4f8002624fa2fe6296ad3aac9fcf738fdbbad6c424993d4b",
    "non_claim": "radiance-reference-records-bounded-source-lineage-execution-and-convergence-facts-without-proving-compiler-correctness-seed-trust-semantic-equivalence-or-universal-reproducibility"
  },
  "source_bundle_blake3": "21f962ce6bf2ba89cbd94758d95abe8418cbafc243cdc81a146693d00f2539f4",
  "source_state_blake3": "f7f7c80eff2072784b7e55f236129862ab1ea9cb713ab41f807a533190894cbd",
  "plan": {
    "schema": "mantle-radiance-reference-plan-v1",
    "source_cohort_blake3": "80c82a016b6232aa4f8002624fa2fe6296ad3aac9fcf738fdbbad6c424993d4b",
    "source_bundle_blake3": "21f962ce6bf2ba89cbd94758d95abe8418cbafc243cdc81a146693d00f2539f4",
    "stages": [
      {
        "route": "seed",
        "stage": 1,
        "launch_kind": "emulated-compiler",
        "predecessor_role": "radiance-seed",
        "source_projection": ".",
        "output_role": "seed-stage-1"
      },
      {
        "route": "seed",
        "stage": 2,
        "launch_kind": "emulated-compiler",
        "predecessor_role": "seed-stage-1",
        "source_projection": ".",
        "output_role": "seed-stage-2"
      },
      {
        "route": "seed",
        "stage": 3,
        "launch_kind": "emulated-compiler",
        "predecessor_role": "seed-stage-2",
        "source_projection": ".",
        "output_role": "seed-stage-3"
      },
      {
        "route": "c99",
        "stage": 1,
        "launch_kind": "native-bootstrap",
        "predecessor_role": "radiance-s0",
        "source_projection": ".",
        "output_role": "c99-stage-1"
      },
      {
        "route": "c99",
        "stage": 2,
        "launch_kind": "emulated-compiler",
        "predecessor_role": "c99-stage-1",
        "source_projection": ".",
        "output_role": "c99-stage-2"
      },
      {
        "route": "c99",
        "stage": 3,
        "launch_kind": "emulated-compiler",
        "predecessor_role": "c99-stage-2",
        "source_projection": ".",
        "output_role": "c99-stage-3"
      }
    ],
    "plan_blake3": "c633f5936848ae2ecf29a462a9b6d1e58d0e0658ac872065cbee13d456505cc2",
    "non_claim": "radiance-reference-records-bounded-source-lineage-execution-and-convergence-facts-without-proving-compiler-correctness-seed-trust-semantic-equivalence-or-universal-reproducibility"
  },
  "tools": [
    {
      "role": "host-c-compiler",
      "digest_blake3": "bf001a7008d11536ffda1370cd0368d13b80ef7e6aa4c0f579ca8e74694acdb2",
      "byte_count": 11533
    },
    {
      "role": "host-c-compiler-driver",
      "digest_blake3": "acfd6b4ca32ff8dd24bbc0a5254949f7e4568e7841ab1a8208b39f1c5326734e",
      "byte_count": 216200
    },
    {
      "role": "host-linker",
      "digest_blake3": "746fd75279b882f5cfb425627e593b3187ce348b0b8bdbda763361e7b3428c03",
      "byte_count": 8738448
    },
    {
      "role": "host-crt-inputs",
      "digest_blake3": "ebf9bad0070579d25d7b88a23089ebd5f82fd6e12fa47a64f54b006b939fa122",
      "byte_count": 14315343
    },
    {
      "role": "host-libgcc-inputs",
      "digest_blake3": "1df3e2cb7404f995ee4da9ac4f40c1bd4615969fa9435541f4ca7f5ffccf989d",
      "byte_count": 17595978
    },
    {
      "role": "bootstrap-compiler",
      "digest_blake3": "ac040ea04c2a83b521c87c53a2bce2cc77b7efbab52f781ad5e1e7af24e53c75",
      "byte_count": 163592
    },
    {
      "role": "emulator",
      "digest_blake3": "ce738d442238fa06553a857118b588b4c998ce963d6279389ef57394b3280672",
      "byte_count": 100368
    },
    {
      "role": "seed",
      "digest_blake3": "a06905539bd81c9581218ca648e98fb7a55c5a7e79847b6c840181a3e2605b07",
      "byte_count": 1285492
    }
  ],
  "stages": [
    {
      "route": "seed",
      "stage": 1,
      "launch_kind": "emulated-compiler",
      "launcher_blake3": "ce738d442238fa06553a857118b588b4c998ce963d6279389ef57394b3280672",
      "predecessor_blake3": "a06905539bd81c9581218ca648e98fb7a55c5a7e79847b6c840181a3e2605b07",
      "output_role": "seed-stage-1",
      "output_blake3": "a06905539bd81c9581218ca648e98fb7a55c5a7e79847b6c840181a3e2605b07",
      "output_bytes": 1285492,
      "exit_code": 0,
      "stdout_blake3": "af1349b9f5f9a1a6a0404dea36dcc9499bcb25c9adc112b7cc9a93cae41f3262",
      "stderr_blake3": "5fe5974c17811d78442506edcfb878dc3c2b388133dc3b226f5550c5f6e4eb18",
      "protected_audit_blake3": "4ce108463036e84eb77c0cd971f8a64bcdbb7122be912208168d9a959c6d735f",
      "protected_audit_event_count": 1,
      "denied_event_count": 0
    },
    {
      "route": "seed",
      "stage": 2,
      "launch_kind": "emulated-compiler",
      "launcher_blake3": "ce738d442238fa06553a857118b588b4c998ce963d6279389ef57394b3280672",
      "predecessor_blake3": "a06905539bd81c9581218ca648e98fb7a55c5a7e79847b6c840181a3e2605b07",
      "output_role": "seed-stage-2",
      "output_blake3": "a06905539bd81c9581218ca648e98fb7a55c5a7e79847b6c840181a3e2605b07",
      "output_bytes": 1285492,
      "exit_code": 0,
      "stdout_blake3": "af1349b9f5f9a1a6a0404dea36dcc9499bcb25c9adc112b7cc9a93cae41f3262",
      "stderr_blake3": "b9f645668f6fbd26a9130d87bb9ee93617d612d32ab702de9bf5a740dd630487",
      "protected_audit_blake3": "d536a33c23b1ee8d60d08c5fc9bc8b3db8faae2c4ef74f408139698c430eab45",
      "protected_audit_event_count": 1,
      "denied_event_count": 0
    },
    {
      "route": "seed",
      "stage": 3,
      "launch_kind": "emulated-compiler",
      "launcher_blake3": "ce738d442238fa06553a857118b588b4c998ce963d6279389ef57394b3280672",
      "predecessor_blake3": "a06905539bd81c9581218ca648e98fb7a55c5a7e79847b6c840181a3e2605b07",
      "output_role": "seed-stage-3",
      "output_blake3": "a06905539bd81c9581218ca648e98fb7a55c5a7e79847b6c840181a3e2605b07",
      "output_bytes": 1285492,
      "exit_code": 0,
      "stdout_blake3": "af1349b9f5f9a1a6a0404dea36dcc9499bcb25c9adc112b7cc9a93cae41f3262",
      "stderr_blake3": "56b494b6ff4e8658cdd9a258b650a678542d70859db8edb7ab3d330a0dfef4ec",
      "protected_audit_blake3": "ec2df2784d71b9d48fc7c7f65007b9dd1093b8e03f33f0526832bc5c434b1337",
      "protected_audit_event_count": 1,
      "denied_event_count": 0
    },
    {
      "route": "c99",
      "stage": 1,
      "launch_kind": "native-bootstrap",
      "launcher_blake3": "ac040ea04c2a83b521c87c53a2bce2cc77b7efbab52f781ad5e1e7af24e53c75",
      "predecessor_blake3": "ac040ea04c2a83b521c87c53a2bce2cc77b7efbab52f781ad5e1e7af24e53c75",